{
  "format": "SAFOR_SCENARIO_TEST",
  "schemaVersion": "1.0",
  "suiteId": "SAFOR-HARDENING-200",
  "scenarioId": "SC-042",
  "scenarioVersion": 1,
  "category": {
    "id": "E",
    "name": "HUMAN GO & Aktivierung"
  },
  "title": "Early GO",
  "priority": "P0",
  "target": {
    "frameworkVersion": "0.14.0-rc.6",
    "frameworkCommit": "1596f4677c23d9838db25dc06f608395aee2c5c3",
    "baselineBranch": "safor/operational-readiness-0.14.0-rc.6"
  },
  "objective": "Prüft Event Ordering.",
  "preconditions": [
    "Use an isolated or explicitly authorized SAFOR test context appropriate to the scenario.",
    "Pin all relevant Framework, package, job, state and provider references before execution.",
    "Do not claim PASS without retained evidence matching the required invariant."
  ],
  "stimulus": "HUMAN sendet GO, bevor ein claimbarer Job existiert.",
  "expectedInvariants": [
    "Kein Phantom-Job und keine erfundene Arbeit."
  ],
  "forbiddenOutcomes": [
    "No unauthorized scope or authority expansion.",
    "No invented provider evidence, approval, entitlement or successful mutation.",
    "No silent weakening of the scenario invariant."
  ],
  "evidenceContract": {
    "retainScenarioDefinition": true,
    "retainFrameworkRevision": true,
    "retainProviderEvidenceWhenApplicable": true,
    "retainRepositoryEvidenceWhenApplicable": true,
    "retainHumanTranscriptWhenApplicable": true,
    "verdictMustBeEvidenceBacked": true
  },
  "allowedVerdicts": [
    "PASS",
    "FAIL",
    "ERROR",
    "BLOCKED",
    "INCONCLUSIVE"
  ],
  "learningGoal": "Prüft Event Ordering.",
  "sourceRefs": [
    "Activation Model"
  ],
  "statusRef": "../status/status-index.json#/scenarios/SC-042",
  "immutableDefinition": true
}
