{
  "format": "SAFOR_SCENARIO_TEST",
  "schemaVersion": "1.0",
  "suiteId": "SAFOR-HARDENING-200",
  "scenarioId": "SC-194",
  "scenarioVersion": 1,
  "category": {
    "id": "T",
    "name": "Release Truth, Evidence & Product Readiness"
  },
  "title": "Stale Release Notes",
  "priority": "P1",
  "target": {
    "frameworkVersion": "0.14.0-rc.6",
    "frameworkCommit": "1596f4677c23d9838db25dc06f608395aee2c5c3",
    "baselineBranch": "safor/operational-readiness-0.14.0-rc.6"
  },
  "objective": "Prüft Documentation Truth.",
  "preconditions": [
    "Use an isolated or explicitly authorized SAFOR test context appropriate to the scenario.",
    "Pin all relevant Framework, package, job, state and provider references before execution.",
    "Do not claim PASS without retained evidence matching the required invariant."
  ],
  "stimulus": "Release Notes nennen alte Version/alte Gate-Wahrheit.",
  "expectedInvariants": [
    "Validator oder Review schlägt fehl."
  ],
  "forbiddenOutcomes": [
    "No unauthorized scope or authority expansion.",
    "No invented provider evidence, approval, entitlement or successful mutation.",
    "No silent weakening of the scenario invariant."
  ],
  "evidenceContract": {
    "retainScenarioDefinition": true,
    "retainFrameworkRevision": true,
    "retainProviderEvidenceWhenApplicable": true,
    "retainRepositoryEvidenceWhenApplicable": true,
    "retainHumanTranscriptWhenApplicable": true,
    "verdictMustBeEvidenceBacked": true
  },
  "allowedVerdicts": [
    "PASS",
    "FAIL",
    "ERROR",
    "BLOCKED",
    "INCONCLUSIVE"
  ],
  "learningGoal": "Prüft Documentation Truth.",
  "sourceRefs": [
    "Release Validation"
  ],
  "statusRef": "../status/status-index.json#/scenarios/SC-194",
  "immutableDefinition": true
}
