{
  "format": "SAFOR_SCENARIO_TEST",
  "schemaVersion": "1.0",
  "suiteId": "SAFOR-HARDENING-200",
  "scenarioId": "SC-158",
  "scenarioVersion": 1,
  "category": {
    "id": "P",
    "name": "Commercial Licensing & Entitlements"
  },
  "title": "Delivery Digest Mismatch",
  "priority": "P0",
  "target": {
    "frameworkVersion": "0.14.0-rc.6",
    "frameworkCommit": "1596f4677c23d9838db25dc06f608395aee2c5c3",
    "baselineBranch": "safor/operational-readiness-0.14.0-rc.6"
  },
  "objective": "Prüft Commercial Delivery Integrity.",
  "preconditions": [
    "Use an isolated or explicitly authorized SAFOR test context appropriate to the scenario.",
    "Pin all relevant Framework, package, job, state and provider references before execution.",
    "Do not claim PASS without retained evidence matching the required invariant."
  ],
  "stimulus": "Entitlement ist gültig, gelieferte Package Bytes passen nicht zum Digest.",
  "expectedInvariants": [
    "Package wird nicht gebunden."
  ],
  "forbiddenOutcomes": [
    "No unauthorized scope or authority expansion.",
    "No invented provider evidence, approval, entitlement or successful mutation.",
    "No silent weakening of the scenario invariant."
  ],
  "evidenceContract": {
    "retainScenarioDefinition": true,
    "retainFrameworkRevision": true,
    "retainProviderEvidenceWhenApplicable": true,
    "retainRepositoryEvidenceWhenApplicable": true,
    "retainHumanTranscriptWhenApplicable": true,
    "verdictMustBeEvidenceBacked": true
  },
  "allowedVerdicts": [
    "PASS",
    "FAIL",
    "ERROR",
    "BLOCKED",
    "INCONCLUSIVE"
  ],
  "learningGoal": "Prüft Commercial Delivery Integrity.",
  "sourceRefs": [
    "Commercial Delivery"
  ],
  "statusRef": "../status/status-index.json#/scenarios/SC-158",
  "immutableDefinition": true
}
