{
  "format": "SAFOR_SCENARIO_TEST",
  "schemaVersion": "1.0",
  "suiteId": "SAFOR-HARDENING-200",
  "scenarioId": "SC-150",
  "scenarioVersion": 1,
  "category": {
    "id": "O",
    "name": "Migration & Versioning"
  },
  "title": "Incompatible Package Upgrade",
  "priority": "P0",
  "target": {
    "frameworkVersion": "0.14.0-rc.6",
    "frameworkCommit": "1596f4677c23d9838db25dc06f608395aee2c5c3",
    "baselineBranch": "safor/operational-readiness-0.14.0-rc.6"
  },
  "objective": "Prüft Atomic Replacement.",
  "preconditions": [
    "Use an isolated or explicitly authorized SAFOR test context appropriate to the scenario.",
    "Pin all relevant Framework, package, job, state and provider references before execution.",
    "Do not claim PASS without retained evidence matching the required invariant."
  ],
  "stimulus": "Neue Factory ist nicht kompatibel.",
  "expectedInvariants": [
    "Bisherige gültige Bindung bleibt erhalten; Upgrade wird abgelehnt."
  ],
  "forbiddenOutcomes": [
    "No unauthorized scope or authority expansion.",
    "No invented provider evidence, approval, entitlement or successful mutation.",
    "No silent weakening of the scenario invariant."
  ],
  "evidenceContract": {
    "retainScenarioDefinition": true,
    "retainFrameworkRevision": true,
    "retainProviderEvidenceWhenApplicable": true,
    "retainRepositoryEvidenceWhenApplicable": true,
    "retainHumanTranscriptWhenApplicable": true,
    "verdictMustBeEvidenceBacked": true
  },
  "allowedVerdicts": [
    "PASS",
    "FAIL",
    "ERROR",
    "BLOCKED",
    "INCONCLUSIVE"
  ],
  "learningGoal": "Prüft Atomic Replacement.",
  "sourceRefs": [
    "Package Model"
  ],
  "statusRef": "../status/status-index.json#/scenarios/SC-150",
  "immutableDefinition": true
}
