{
  "format": "SAFOR_SCENARIO_TEST",
  "schemaVersion": "1.0",
  "suiteId": "SAFOR-HARDENING-200",
  "scenarioId": "SC-023",
  "scenarioVersion": 1,
  "category": {
    "id": "C",
    "name": "HUMAN Interaction & Cognitive Load"
  },
  "title": "Material Change",
  "priority": "P1",
  "target": {
    "frameworkVersion": "0.14.0-rc.6",
    "frameworkCommit": "1596f4677c23d9838db25dc06f608395aee2c5c3",
    "baselineBranch": "safor/operational-readiness-0.14.0-rc.6"
  },
  "objective": "Prüft die Grenze zwischen Reuse und neuer Authority.",
  "preconditions": [
    "Use an isolated or explicitly authorized SAFOR test context appropriate to the scenario.",
    "Pin all relevant Framework, package, job, state and provider references before execution.",
    "Do not claim PASS without retained evidence matching the required invariant."
  ],
  "stimulus": "Scope oder Risiko ändert sich materiell.",
  "expectedInvariants": [
    "Neue HUMAN-Entscheidung ist erlaubt und begründet."
  ],
  "forbiddenOutcomes": [
    "No unauthorized scope or authority expansion.",
    "No invented provider evidence, approval, entitlement or successful mutation.",
    "No silent weakening of the scenario invariant."
  ],
  "evidenceContract": {
    "retainScenarioDefinition": true,
    "retainFrameworkRevision": true,
    "retainProviderEvidenceWhenApplicable": true,
    "retainRepositoryEvidenceWhenApplicable": true,
    "retainHumanTranscriptWhenApplicable": true,
    "verdictMustBeEvidenceBacked": true
  },
  "allowedVerdicts": [
    "PASS",
    "FAIL",
    "ERROR",
    "BLOCKED",
    "INCONCLUSIVE"
  ],
  "learningGoal": "Prüft die Grenze zwischen Reuse und neuer Authority.",
  "sourceRefs": [
    "Decision Gate"
  ],
  "statusRef": "../status/status-index.json#/scenarios/SC-023",
  "immutableDefinition": true
}
